Фамилия;Имя;Отчество;Пол;Дата рождения;Возраст;Номер телефона;Адрес прописки;Регион;Серия и номер паспорта
Наливкин;Григорий;Юлианович;Мужчина;18.05.1991;30;+7 (990) 832-26-90;Россия, г. Сургут, Белорусская ул., д. 17 кв.192;Краснодарский край;4150 971009
Шалупова;Александра;Порфнрьевна;Женщина;15.05.1963;58;+7 (998) 732-74-92;Россия, г. Кисловодск, Ленина В.И.ул., д. 18 кв.200;Ростовская область;4386 557938
Дрягин;Прохор;Юрьевич;Мужчина;14.01.1991;31;+7 (959) 356-88-61;Россия, г. Рыбинск, Луговая ул., д. 7 кв.73;Ставропольский край;4724 546623
Канаев;Ефим;Степанович;Мужчина;28.08.1966;55;+7 (911) 776-73-51;Россия, г. Волжский, Молодежный пер., д. 14 кв.169;Республика Калмыкия;4631 134092
Лебединская;Юлиана;Юлиановна;Женщина;08.09.1995;26;+7 (934) 904-93-78;Россия, г. Владимир, Дачная ул., д. 6 кв.36;Иркутская область;4590 186812
Щегельский;Евгений;Герасимович;Мужчина;21.12.1980;41;+7 (914) 798-24-80;Россия, г. Петрозаводск, Полесская ул., д. 16 кв.55;Белгородская область;4754 952252
Федоренко;Екатерина;Валерьевна;Женщина;05.12.1971;50;+7 (907) 210-33-10;Россия, г. Химки, Первомайский пер., д. 25 кв.180;Московская область;4515 551323
Брынских;Игнат;Емельянович;Мужчина;10.10.1973;48;+7 (915) 568-36-23;Россия, г. Сочи, Коммунистическая ул., д. 3 кв.51;Удмуртская Республика;4285 591441
Ягубова;Рада;Григориевна;Женщина;27.11.1989;32;+7 (930) 909-20-11;Россия, г. Ноябрьск, Мичурина ул., д. 8 кв.15;Ростовская область;4847 219901
Исакова;Раиса;Данииловна;Женщина;03.07.1969;52;+7 (944) 129-25-98;Россия, г. Якутск, Юбилейная ул., д. 7 кв.77;Республика Бурятия;4741 500578
Николенко;Алиса;Петровна;Женщина;09.07.1981;40;+7 (915) 664-60-21;Россия, г. Владикавказ, Приозерная ул., д. 14 кв.63;Республика Татарстан;4074 144783
Базин;Александр;Гаврннлович;Мужчина;10.04.1968;53;+7 (944) 378-52-51;Россия, г. Сызрань, Набережная ул., д. 22 кв.217;Республика Тыва;4448 366829
Рабинович;Юлиан;Адамович;Мужчина;23.11.1988;33;+7 (979) 267-81-82;Россия, г. Железногорск, Солнечный пер., д. 3 кв.91;Московская область;4367 708082
Акчурин;Алексей;Саввеевич;Мужчина;20.08.1975;46;+7 (913) 110-32-37;Россия, г. Нефтеюганск, Лесной пер., д. 8 кв.13;Краснодарский край;4462 276337
Лосева;Арина;Яковна;Женщина;07.02.1980;41;+7 (907) 460-68-28;Россия, г. Сергиев Посад, Первомайский пер., д. 22 кв.150;Республика Татарстан;4366 983928
Ярмольник;София;Михаиловна;Женщина;21.03.1966;55;+7 (983) 147-62-75;Россия, г. Тула, Советский пер., д. 16 кв.55;Волгоградская область;4946 897451
Ялчевский;Константин;Маркович;Мужчина;08.09.1967;54;+7 (980) 110-41-63;Россия, г. Королёв, Лесная ул., д. 23 кв.5;Респ. Саха (Якутия);4761 654967
Запорожец;Тимофей;Прохорович;Мужчина;20.02.1974;47;+7 (915) 835-29-47;Россия, г. Стерлитамак, Заречный пер., д. 25 кв.29;Пермский край;4671 367592
Корниенко;Игнат;Феодосивич;Мужчина;10.03.1980;41;+7 (960) 861-93-61;Россия, г. Курск, Рабочая ул., д. 6 кв.56;Московская область;4521 377337
Жданов;Тимофей;Ефимович;Мужчина;15.10.1987;34;+7 (905) 317-44-29;Россия, г. Улан-Удэ, Майская ул., д. 2 кв.148;Челябинская область;4067 403148
Гибазова;Пелагея;Ефимовна;Женщина;14.02.1961;60;+7 (938) 696-49-79;Россия, г. Энгельс, Колхозный пер., д. 7 кв.170;Ставропольский край;4855 622199
Кондуров;Кирилл;Афанасьевич;Мужчина;25.10.1965;56;+7 (975) 253-95-32;Россия, г. Кисловодск, Речная ул., д. 3 кв.129;Саратовская область;4798 908860
Юшков;Алексей;Венедиктович;Мужчина;06.01.1960;62;+7 (905) 935-47-88;Россия, г. Петрозаводск, Садовая ул., д. 20 кв.144;Хабаровский край;4821 210371
Индик;Виталий;Ильич;Мужчина;13.09.1987;34;+7 (949) 592-90-78;Россия, г. Новочеркасск, Полевая ул., д. 18 кв.97;Респ. Башкортостан;4248 795511
Киселёв;Игнат;Савванович;Мужчина;22.07.1976;45;+7 (995) 157-23-73;Россия, г. Ростов-на-Дону, Садовая ул., д. 12 кв.109;Самарская область;4689 275164
Луньков;Павел;Георгиевич;Мужчина;18.08.1968;53;+7 (911) 773-72-95;Россия, г. Калининград, Октябрьская ул., д. 20 кв.203;Пермский край;4257 859475
Думановская;Марианна;Павловна;Женщина;01.02.1993;28;+7 (996) 448-38-53;Россия, г. Батайск, Зеленый пер., д. 24 кв.97;Республика Татарстан;4833 436835
Каблуков;Прохор;Максимович;Мужчина;04.04.1991;30;+7 (988) 423-22-59;Россия, г. Армавир, Калинина ул., д. 19 кв.17;Пермский край;4042 444289
Брежнев;Семен;Петрович;Мужчина;25.06.1976;45;+7 (978) 904-26-61;Россия, г. Шахты, Красноармейская ул., д. 25 кв.91;Московская область;4840 540224
Ямзин;Иннокентий;Ираклиевич;Мужчина;15.05.1988;33;+7 (922) 569-47-47;Россия, г. Электросталь, Спортивная ул., д. 21 кв.209;Псковская область;4142 362484
Тихонова;София;Степановна;Женщина;22.07.1976;45;+7 (936) 541-41-96;Россия, г. Евпатория, Молодежная ул., д. 14 кв.122;Республика Крым;4642 108737
Семин;Георгий;Ефимович;Мужчина;08.12.1968;53;+7 (923) 914-41-94;Россия, г. Ярославль, Чапаева ул., д. 12 кв.218;Московская область;4086 167159
Кораблёв;Ефрем;Саввеевич;Мужчина;28.01.1968;54;+7 (926) 306-15-37;Россия, г. Магнитогорск, Советская ул., д. 16 кв.151;Курганская область;4349 963924
Ягода;Антон;Иннокентиевич;Мужчина;09.08.1991;30;+7 (905) 615-79-11;Россия, г. Люберцы, Центральный пер., д. 1 кв.27;Ярославская область;4291 617259
Комолова;Тамара;Елизаровна;Женщина;05.02.1969;52;+7 (970) 140-46-98;Россия, г. Новочебоксарск, Озерный пер., д. 20 кв.29;Волгоградская область;4279 406940
Красоткин;Егор;Егорович;Мужчина;04.08.1962;59;+7 (988) 966-34-85;Россия, г. Нефтекамск, Спортивная ул., д. 13 кв.175;Самарская область;4175 590039
Маркина;Зинаида;Леонтьевна;Женщина;07.05.1978;43;+7 (914) 807-91-21;Россия, г. Пенза, Советская ул., д. 15 кв.192;Чувашская Республика;4164 319319
Шашков;Михаил;Порфирьевич;Мужчина;17.05.1984;37;+7 (972) 461-50-98;Россия, г. Волгодонск, Светлая ул., д. 11 кв.55;Новгородская область;4895 567341
Перевёртова;Нонна;Ивановна;Женщина;03.11.1968;53;+7 (914) 398-11-30;Россия, г. Каменск - Уральский, Речная ул., д. 22 кв.191;Владимирская область;4653 558292
Масмех;Елена;Тимофеевна;Женщина;17.08.1979;42;+7 (963) 823-69-50;Россия, г. Нижневартовск, Озерная ул., д. 25 кв.122;Томская область;4963 941931
Осин;Ростислав;Федорович;Мужчина;15.12.1970;51;+7 (934) 634-87-48;Россия, г. Октябрьский, Кирова ул., д. 15 кв.220;гор. Москва;4493 468963
Перехваткина;Ульяна;Никифоровна;Женщина;14.05.1974;47;+7 (995) 165-49-71;Россия, г. Тверь, Шоссейная ул., д. 1 кв.211;Московская область;4125 485861
Суружу;Зоя;Сергеевна;Женщина;16.09.1975;46;+7 (916) 836-31-17;Россия, г. Ногинск, Южная ул., д. 12 кв.116;Кемеровская область;4212 894815
Кутикова;Римма;Филипповна;Женщина;16.07.1991;30;+7 (971) 242-57-50;Россия, г. Саратов, Южная ул., д. 17 кв.220;Рязанская область;4767 476167
Францев;Федот;Гаврннлович;Мужчина;11.12.1993;28;+7 (913) 825-60-18;Россия, г. Березники, Полевой пер., д. 24 кв.129;Челябинская область;4777 172104
Ухтомская;Алла;Ипполитовна;Женщина;08.07.1987;34;+7 (996) 740-61-69;Россия, г. Орехово-Зуево, 3 Марта ул., д. 15 кв.65;Хабаровский край;4740 532264
Соломин;Максим;Михаилович;Мужчина;12.05.1992;29;+7 (923) 375-35-96;Россия, г. Березники, Зеленая ул., д. 18 кв.94;Самарская область;4091 246162
Любимов;Семен;Юрьевич;Мужчина;21.08.1981;40;+7 (943) 718-42-24;Россия, г. Кемерово, Гагарина ул., д. 20 кв.174;Ямало-Ненецкий АО;4799 293540
Дрёмин;Василий;Филиппович;Мужчина;22.12.1971;50;+7 (983) 400-19-61;Россия, г. Новокузнецк, Минская ул., д. 14 кв.18;Саратовская область;4874 690769
Стрекалов;Максим;Михаилович;Мужчина;26.06.1980;41;+7 (987) 113-34-53;Россия, г. Красногорск, Центральный пер., д. 3 кв.63;Московская область;4580 560549
Кирдань;Афанасий;Григорьевич;Мужчина;28.03.1989;32;+7 (996) 216-86-48;Россия, г. Находка, Кирова ул., д. 9 кв.37;Тверская область;4474 464432
Зубарев;Юрин;Даниилович;Мужчина;01.03.1969;52;+7 (922) 473-80-56;Россия, г. Новокузнецк, Полесская ул., д. 2 кв.79;Самарская область;4983 393560
Викариев;Павел;Герасимович;Мужчина;01.03.1970;51;+7 (969) 762-68-18;Россия, г. Жуковский, Мирная ул., д. 11 кв.102;Томская область;4561 187608
Дагиров;Адам;Герасимович;Мужчина;21.08.1983;38;+7 (933) 594-81-56;Россия, г. Ростов-на-Дону, Озерная ул., д. 20 кв.67;Московская область;4826 700356
Никашина;Альбина;Михаиловна;Женщина;10.05.1996;25;+7 (987) 267-32-10;Россия, г. Новосибирск, Строителей ул., д. 3 кв.16;Кабардино-Балкарская Респ.;4492 804673
Карякин;Арсений;Леонтьевич;Мужчина;19.02.1960;61;+7 (936) 663-95-37;Россия, г. Новокузнецк, Озерный пер., д. 1 кв.59;Респ. Башкортостан;4382 302626
Мерзлова;Валерия;Васильевна;Женщина;23.02.1996;25;+7 (978) 955-20-57;Россия, г. Новый Уренгой, Западная ул., д. 8 кв.51;Республика Дагестан;4578 403630
Ухов;Константин;Власович;Мужчина;19.03.1996;25;+7 (968) 687-72-81;Россия, г. Иркутск, Колхозный пер., д. 24 кв.93;Самарская область;4280 259581
Помелов;Алексей;Елизарович;Мужчина;21.01.1983;39;+7 (985) 380-87-44;Россия, г. Сургут, Советский пер., д. 15 кв.108;Оренбургская область;4226 886232
Чернявский;Дмитрий;Трофимович;Мужчина;24.09.1962;59;+7 (926) 638-21-28;Россия, г. Электросталь, Набережная ул., д. 8 кв.27;Московская область;4212 317606
Гусельников;Максим;Петрович;Мужчина;20.09.1982;39;+7 (935) 280-25-87;Россия, г. Саранск, Школьный пер., д. 8 кв.138;Архангельская обл. без НАО;4129 626727
Морякова;Серафима;Филипповна;Женщина;24.02.1984;37;+7 (993) 941-62-65;Россия, г. Камышин, Тихая ул., д. 15 кв.76;Свердловская область;4135 119955
Гулин;Семен;Никифорович;Мужчина;01.06.1986;35;+7 (949) 271-43-12;Россия, г. Казань, Набережная ул., д. 25 кв.113;Вологодская область;4788 542195
Степанков;Федот;Никанорович;Мужчина;07.01.1990;32;+7 (944) 461-89-84;Россия, г. Ачинск, 3 Марта ул., д. 12 кв.120;Респ. Башкортостан;4619 122955
Каипова;Александра;Денисовна;Женщина;22.06.1960;61;+7 (960) 422-31-83;Россия, г. Новошахтинск, Совхозная ул., д. 11 кв.35;Гор. Севастополь;4928 765544
Стукалов;Марк;Панкратович;Мужчина;01.04.1996;25;+7 (910) 677-88-54;Россия, г. Самара, Красноармейская ул., д. 10 кв.28;гор. Санкт-Петербург;4017 839545
Сиянковский;Юлиан;Георгиевич;Мужчина;12.02.1979;42;+7 (980) 810-22-19;Россия, г. Арзамас, 3 Марта ул., д. 13 кв.56;Республика Марий Эл;4619 706618
Портнова;Альбина;Никаноровна;Женщина;26.05.1970;51;+7 (995) 952-28-17;Россия, г. Саратов, Строителей ул., д. 5 кв.5;Республика Крым;4392 184399
Экземплярский;Михаил;Константинович;Мужчина;24.04.1971;50;+7 (976) 568-43-31;Россия, г. Реутов, Партизанская ул., д. 17 кв.27;Ивановская область;4262 498298
Баязов;Павел;Артемович;Мужчина;14.12.1978;43;+7 (948) 934-47-92;Россия, г. Альметьевск, Новоселов ул., д. 22 кв.123;Ульяновская область;4575 282820
Мартьянов;Афанасий;Филиппович;Мужчина;26.11.1977;44;+7 (926) 857-70-47;Россия, г. Воронеж, Дзержинского ул., д. 19 кв.73;Ярославская область;4639 930194
Русских;Валерия;Севастьяновна;Женщина;02.03.1974;47;+7 (959) 110-82-85;Россия, г. Барнаул, Хуторская ул., д. 5 кв.173;Иркутская область;4125 772586
Скворцова;Анфиса;Юлиановна;Женщина;24.02.1980;41;+7 (929) 942-48-17;Россия, г. Новороссийск, Дачная ул., д. 25 кв.107;Республика Дагестан;4451 108213
Пондяков;Николай;Егорович;Мужчина;08.10.1988;33;+7 (949) 848-27-35;Россия, г. Таганрог, Хуторская ул., д. 22 кв.53;Приморский край;4097 894578
Буков;Виталий;Егорович;Мужчина;25.01.1982;39;+7 (943) 814-28-65;Россия, г. Петропавловск-Камчатский, Пионерская ул., д. 10 кв.54;Республика Дагестан;4716 483692
Трушевский;Георгий;Никандрович;Мужчина;07.12.1960;61;+7 (971) 977-17-89;Россия, г. Тверь, 17 Сентября ул., д. 16 кв.105;Респ. Башкортостан;4687 299320
Якимов;Георгий;Макарович;Мужчина;20.06.1996;25;+7 (954) 641-57-43;Россия, г. Тамбов, Интернациональная ул., д. 14 кв.54;Вологодская область;4559 302476
Кабалкин;Виктор;Максимоич;Мужчина;15.02.1977;44;+7 (919) 739-74-70;Россия, г. Челябинск, Октябрьская ул., д. 17 кв.138;Красноярский край;4074 289886
Никанорова;Елена;Антоновна;Женщина;27.02.1965;56;+7 (943) 889-92-32;Россия, г. Курск, Юбилейная ул., д. 17 кв.36;Московская область;4112 584284
Живенкова;Анна;Климентьевна;Женщина;25.03.1961;60;+7 (966) 744-74-62;Россия, г. Прокопьевск, Ленина В.И.ул., д. 25 кв.129;Ульяновская область;4232 534244
Ягодина;Антонина;Вениаминовна;Женщина;01.02.1973;48;+7 (911) 145-37-12;Россия, г. Кемерово, Садовый пер., д. 6 кв.100;Респ. Северная Осетия-Алания;4858 334539
Пермякова;Карина;Валентиновна;Женщина;10.01.1965;57;+7 (961) 591-47-72;Россия, г. Волгоград, Заводская ул., д. 11 кв.51;Ставропольский край;4032 415114
Колобова;Сюзанна;Прохор;Женщина;04.02.1979;42;+7 (983) 351-16-88;Россия, г. Челябинск, Песчаная ул., д. 18 кв.207;Самарская область;4478 659844
Родина;Елизавета;Ростиславовна;Женщина;26.04.1996;25;+7 (945) 292-20-78;Россия, г. Великий Новгород, Восточная ул., д. 1 кв.207;Республика Башкортостан;4851 379785
Карандашов;Егор;Яковлевич;Мужчина;25.02.1982;39;+7 (968) 823-85-57;Россия, г. Волгодонск, Школьная ул., д. 12 кв.195;Свердловская область;4880 540446
Убыш;Настасья;Давидович;Женщина;17.03.1992;29;+7 (977) 854-56-17;Россия, г. Прокопьевск, Максима Горького ул., д. 3 кв.153;Пермский край;4519 463697
Благово;Полина;Гермоновна;Женщина;21.06.1965;56;+7 (960) 209-59-48;Россия, г. Нефтекамск, Чапаева ул., д. 5 кв.165;Красноярский край;4972 921582
Этуша;Надежда;Алексеевна;Женщина;17.10.1971;50;+7 (995) 184-50-73;Россия, г. Камышин, Молодежная ул., д. 16 кв.47;Республика Марий Эл;4822 536800
Комракова;Пелагея;Ефимовна;Женщина;12.02.1967;54;+7 (959) 846-28-87;Россия, г. Липецк, Интернациональная ул., д. 4 кв.70;Краснодарский край;4070 278987
Ягунов;Илья;Алексеевич;Мужчина;04.11.1979;42;+7 (939) 408-78-31;Россия, г. Волжский, Первомайская ул., д. 15 кв.39;Иркутская область;4310 147986
Ахтемиров;Семен;Савванович;Мужчина;16.03.1995;26;+7 (911) 802-21-26;Россия, г. Щёлково, Лесной пер., д. 10 кв.23;Красноярский край;4186 227854
Камкин;Давид;Феоктистович;Мужчина;23.12.1976;45;+7 (931) 495-93-30;Россия, г. Новошахтинск, Садовый пер., д. 18 кв.158;Карачаево-Черкесская Респ.;4038 832265
Салко;Кира;Валерьевна;Женщина;24.05.1974;47;+7 (909) 473-37-33;Россия, г. Новомосковск, Речная ул., д. 24 кв.35;Респ. Башкортостан;4042 104395
Москвитин;Трофим;Николаевич;Мужчина;14.05.1970;51;+7 (945) 765-90-66;Россия, г. Назрань, Центральный пер., д. 23 кв.136;Костромская область;4583 511540
Мишутина;Мила;Никитьевна;Женщина;07.02.1961;60;+7 (967) 989-16-23;Россия, г. Калининград, Лесной пер., д. 16 кв.58;Алтайский край;4356 975609
Голиков;Ефим;Ефимович;Мужчина;13.01.1983;39;+7 (953) 294-44-54;Россия, г. Пермь, Октябрьская ул., д. 15 кв.84;Московская область;4677 471731
Щитт;Зинаида;Адамовна;Женщина;16.07.1967;54;+7 (933) 816-71-48;Россия, г. Бийск, Чкалова ул., д. 15 кв.167;Алтайский край;4871 928138
Саянов;Никифор;Константинович;Мужчина;05.09.1971;50;+7 (971) 537-81-73;Россия, г. Барнаул, Полевой пер., д. 6 кв.66;Владимирская область;4011 773505
Телицын;Константин;Арсеньевич;Мужчина;08.03.1963;58;+7 (984) 266-53-37;Россия, г. Копейск, Озерная ул., д. 25 кв.121;Калужская область;4053 431929
Рамазанов;Степан;Филиппович;Мужчина;23.10.1983;38;+7 (917) 375-49-65;Россия, г. Муром, Якуба Коласа ул., д. 18 кв.30;Самарская область;4531 725366
